{"budget":{"measured_tokens":0,"token_budget":1024},"created_at":"1970-01-01T00:00:00Z","exclusions":[],"pack_id":"pack_643f8353e7494416935c","pack_sha256":"66836be81da178484ff516c8e4c8215d1be382f287627e7db5efc0037d175856","query":{"filters":{},"text":"","weights_version":"leafos.context-rank.v1"},"records":[],"run_id":"r1","schema":"leafos.context-pack.v1","source":{"head_hash":null,"head_sequence":0,"journal_path":"C:\\R\\LeafOS0.2.1\\ProjectLeaf\\leafos_taskpack\\memories\\journal.jsonl"},"task_id":"t1","tokenizer":{"model_id":"smoke-model","tokenizer_id":"leafos.whitespace.v1"}}
